<?xml version="1.0"?>
<configSim xmlns:xsi="http://www.w3.org/2001/XMLSchema-instance"
       xsi:noNamespaceSchemaLocation="config.xsd">
       
	<delta>0.0005</delta>
  	<end>10</end>
  	<output>
  		<dir>vtkOutput/</dir>
  		<filename>RayLeigh3D_Quad_vtk</filename>
  		<iterations>50</iterations>
  	</output>
  	<simulationFile>rayleighTaylor3d.xml</simulationFile>
  	<!--<saveFile>Drop.xml</saveFile>-->

</configSim>

<!--single 611s-->
<!--quad 354s-->